Detail ID,Project,Lead Researcher,Lead Researcher Email,Notes
4,recMtdmBbaFiIF2Tm,Kevin Rapley,kevin.rapley@homeoffice.gov.uk,Some notes that Kevin has left about the project
5,recpZe8mLEiASXfRd,Kevin Rapley,kevin.rapley@homeoffice.gov.uk,"This is a research project for the Bureau Finger Print refresh that will include user interviews, usability testing, accessibility audits, tree testing."
10,recgdpwEI5hF07bUZ,Kevin Rapley,kevin.rapley@homeoffice.gov.uk,Some notes about the project
11,recIFoFmpDIGBP726,Kevin Rapley,kevin.rapley@homeoffice.gov.uk,
12,recUUeazIqBMfsZL4,Kevin Rapley,kevin.rapley@homeoffice.gov.uk,My personal notes